title,time,writer,votes,answers,views,url
How to instrument Cassandra db observability with springboot?,1 min ago,enthusiast,0,0,2,https://stackoverflow.com/questions/78351981/how-to-instrument-cassandra-db-observability-with-springboot
is it a good idea to use kafka for update and insert operations in java project?,3 mins ago,Marugami,0,1,11,https://stackoverflow.com/questions/78351723/is-it-a-good-idea-to-use-kafka-for-update-and-insert-operations-in-java-project
What value is usually provided to client_id field in RegisteredClient objects?,13 mins ago,Suvin Nimnaka Sukka,0,1,16,https://stackoverflow.com/questions/78320601/what-value-is-usually-provided-to-client-id-field-in-registeredclient-objects
Spring doc generated OpenAPI spec validation,16 mins ago,Muchtar,0,0,8,https://stackoverflow.com/questions/78351902/spring-doc-generated-openapi-spec-validation
POST payload is zero in Spring Boot Service,26 mins ago,Captai-N,0,0,9,https://stackoverflow.com/questions/78351849/post-payload-is-zero-in-spring-boot-service
Enable access to BLOB within Azure Storage account via SAS token URL,28 mins ago,Jacob,0,0,10,https://stackoverflow.com/questions/78351839/enable-access-to-blob-within-azure-storage-account-via-sas-token-url
Start an app from layered jar directories?,56 mins ago,chris01,0,0,10,https://stackoverflow.com/questions/78351686/start-an-app-from-layered-jar-directories
Spring boot @ConditionalOnBean does not detect AutoConfiguration bean,1 hour ago,Jiwon,0,0,14,https://stackoverflow.com/questions/78351647/spring-boot-conditionalonbean-does-not-detect-autoconfiguration-bean
Multiple Login screens with different endpoint after login with spring security [closed],1 hour ago,ps-jakob,-1,0,18,https://stackoverflow.com/questions/78347980/multiple-login-screens-with-different-endpoint-after-login-with-spring-security
defined in @EnableJpaRepositories declared on LostandfoundApplication: Not a managed type: class com.lostandfound.lostandfound.model.Item,1 hour ago,Vamshidhar Dawoor,0,0,9,https://stackoverflow.com/questions/78351586/defined-in-enablejparepositories-declared-on-lostandfoundapplication-not-a-man
java.lang.StackOverflowError] with root cause [closed],1 hour ago,Phil,-3,0,16,https://stackoverflow.com/questions/78351542/java-lang-stackoverflowerror-with-root-cause
Dependency injection in JavaFX application with Spring Boot,1 hour ago,David Weber,0,1,30,https://stackoverflow.com/questions/78346407/dependency-injection-in-javafx-application-with-spring-boot
Angular Frontend and Springboot API Backend Azure hosting,2 hours ago,VLAZ,0,1,26,https://stackoverflow.com/questions/78351048/angular-frontend-and-springboot-api-backend-azure-hosting
SpringBoot Application: cannot resolve custom package,2 hours ago,N.F.,0,0,7,https://stackoverflow.com/questions/78339310/springboot-application-cannot-resolve-custom-package
Unable to retrieve Authentication information using ReactiveSecurityContextHolder,2 hours ago,Amit Chudasama,1,1,62,https://stackoverflow.com/questions/78339680/unable-to-retrieve-authentication-information-using-reactivesecuritycontextholde
