title,time,writer,votes,answers,views,url,img
Limit the Maximum Expansion Height for BottomSheetDialogFragment,1 hour ago,jokuskay,0,1,28,https://stackoverflow.com/questions/78349643/limit-the-maximum-expansion-height-for-bottomsheetdialogfragment,https://i.stack.imgur.com/iUUDl.jpg?s=32&g=1
Processing notifications in Android Studio,1 hour ago,Patrick Bateman,1,0,10,https://stackoverflow.com/questions/78363737/processing-notifications-in-android-studio,https://www.gravatar.com/avatar/fa64d1f649becb232d637cb309673278?s=32&d=identicon&r=PG&f=y&so-version=2
What is the difference between lambda and normal Kotlin function?,3 hours ago,InSync,3,1,71,https://stackoverflow.com/questions/78361230/what-is-the-difference-between-lambda-and-normal-kotlin-function,https://i.stack.imgur.com/wECdC.jpg?s=32&g=1
How can I show my Log.i() in my logcat when it is not in the main thread?,4 hours ago,Leviathan,0,1,27,https://stackoverflow.com/questions/78363322/how-can-i-show-my-log-i-in-my-logcat-when-it-is-not-in-the-main-thread,https://www.gravatar.com/avatar/e8c2dc279acf2025292412366e8eb72a?s=32&d=identicon&r=PG&f=y&so-version=2
Modifier Alignment.TopEnd cannot resolve,4 hours ago,Leviathan,0,1,19,https://stackoverflow.com/questions/78363365/modifier-alignment-topend-cannot-resolve,https://www.gravatar.com/avatar/e8c2dc279acf2025292412366e8eb72a?s=32&d=identicon&r=PG&f=y&so-version=2
How to verify deep equality of arguments passed to a Mockk mock?,5 hours ago,blindworld,7,1,1k,https://stackoverflow.com/questions/64819571/how-to-verify-deep-equality-of-arguments-passed-to-a-mockk-mock,https://www.gravatar.com/avatar/19df1e98e7c91e505bb113312a6784bd?s=32&d=identicon&r=PG
Trigger kotlin flow again on pull-to-refresh,5 hours ago,tyczj,0,1,23,https://stackoverflow.com/questions/78362889/trigger-kotlin-flow-again-on-pull-to-refresh,https://www.gravatar.com/avatar/be66588cfacdbed6f5b7581e4eec4c95?s=32&d=identicon&r=PG
Reading LazyListState leads to sporadic recompositions,7 hours ago,me.at.coding,0,0,14,https://stackoverflow.com/questions/78363175/reading-lazyliststate-leads-to-sporadic-recompositions,https://www.gravatar.com/avatar/20c1f68b1bb5c87878c69d5442855a28?s=32&d=identicon&r=PG
Start activity with compose get TransactionTooLargeException error,7 hours ago,Zakaria,0,1,160,https://stackoverflow.com/questions/76332416/start-activity-with-compose-get-transactiontoolargeexception-error,https://i.stack.imgur.com/Hbz0F.png?s=32&g=1
Simple button recomposes on hovering according to LayoutInspector,8 hours ago,me.at.coding,2,1,20,https://stackoverflow.com/questions/78362772/simple-button-recomposes-on-hovering-according-to-layoutinspector,https://www.gravatar.com/avatar/20c1f68b1bb5c87878c69d5442855a28?s=32&d=identicon&r=PG
Collect PagingData from UiState object in ViewModel with Compose,8 hours ago,Stephen Ostermiller,0,2,148,https://stackoverflow.com/questions/77949091/collect-pagingdata-from-uistate-object-in-viewmodel-with-compose,https://i.stack.imgur.com/HZ9CL.png?s=32&g=1
Discrepancies in Calorie Data Aggregation Using HealthConnect API,9 hours ago,Catfoxes,-1,0,18,https://stackoverflow.com/questions/78354519/discrepancies-in-calorie-data-aggregation-using-healthconnect-api,https://i.stack.imgur.com/yqq1z.jpg?s=32&g=1
How to process/read an entire kotlin android applications code base for refactoring,9 hours ago,Hector,-1,0,13,https://stackoverflow.com/questions/78362765/how-to-process-read-an-entire-kotlin-android-applications-code-base-for-refactor,https://i.stack.imgur.com/OrFPh.jpg?s=32&g=1
Is Android Compose Production Ready?,10 hours ago,Gürkan,14,5,5k,https://stackoverflow.com/questions/58576815/is-android-compose-production-ready,https://www.gravatar.com/avatar/9161c6a9677e56ccc88ec7c358dfceb2?s=32&d=identicon&r=PG&f=y&so-version=2
How to convert a composable to PDF,11 hours ago,Jesucrito,-2,1,17,https://stackoverflow.com/questions/78362469/how-to-convert-a-composable-to-pdf,https://www.gravatar.com/avatar/d1f7dacd74f13174c433475fc4da03a9?s=32&d=identicon&r=PG
