title,time,writer,votes,answers,views,url,img
Problems to Install Postgresql connector,5 mins ago,Jonas Costa,-1,0,6,https://stackoverflow.com/questions/tagged/PostgreSQL?tab=active&page=1&pagesize=15,https://lh3.googleusercontent.com/a-/AFdZucoLtZp7621SoaXO_rgj0AJ43TNTxNw7nXvQLPaCtwM=k-s32
PostGres - Get top 5 frequent values in each column from a table,5 mins ago,AlexTank,0,1,8,https://stackoverflow.com/questions/tagged/PostgreSQL?tab=active&page=1&pagesize=15,https://www.gravatar.com/avatar/b9976ee496927a100831c8284ec972da?s=32&d=identicon&r=PG&f=y&so-version=2
How to Implement Dynamic Database Connection in PHP MVC Refactor,12 mins ago,el_jefe213,-1,0,35,https://stackoverflow.com/questions/tagged/PostgreSQL?tab=active&page=1&pagesize=15,https://i.stack.imgur.com/aBQH3.jpg?s=32&g=1
How can I put a database under git (version control)?,13 mins ago,Tails,330,25,184k,https://stackoverflow.com/questions/tagged/PostgreSQL?tab=active&page=1&pagesize=15,https://www.gravatar.com/avatar/a5402f4bcca02fbeab1ad3e8d514665d?s=32&d=identicon&r=PG
Add point to linestring with postgis,36 mins ago,manuele,0,0,5,https://stackoverflow.com/questions/tagged/PostgreSQL?tab=active&page=1&pagesize=15,https://www.gravatar.com/avatar/4b7b19644d45b5e9caf4f4806f1e9267?s=32&d=identicon&r=PG
Enable enable_repartition_joins in CItus,1 hour ago,snakecharmerb,0,0,6,https://stackoverflow.com/questions/tagged/PostgreSQL?tab=active&page=1&pagesize=15,https://i.stack.imgur.com/NOdNo.jpg?s=32&g=1
Supabase Prisma Error: P1001: Can't reach database server at `aws-0-ap-southeast-1.pooler.supabase.com`:`5432`,1 hour ago,Inaara Kalani,0,0,6,https://stackoverflow.com/questions/tagged/PostgreSQL?tab=active&page=1&pagesize=15,https://lh3.googleusercontent.com/a-/AOh14GgoZwvEocOLAgCY8DjilfkZGgO4cbWNlfr1qi2Cew=k-s32
"Postgis upgrade from 3.1.11 to 3.2.7 or 3.3.6 or any higher version fails with an error extension ""postgis"" has no update path",1 hour ago,Karizma,0,0,9,https://stackoverflow.com/questions/tagged/PostgreSQL?tab=active&page=1&pagesize=15,https://www.gravatar.com/avatar/35f7457e6d0b714259bf44243493919f?s=32&d=identicon&r=PG&f=y&so-version=2
"PostgreSQL, time series - Looking for a way to omit timestamps if a row contains one or more zeroes",1 hour ago,kreaturen,0,1,73,https://stackoverflow.com/questions/tagged/PostgreSQL?tab=active&page=1&pagesize=15,https://www.gravatar.com/avatar/ec092bbed05f80300bc34c22528da26f?s=32&d=identicon&r=PG&f=y&so-version=2
Postgresql shows duplicated rows when joining,1 hour ago,Thorsten Kettner,2,2,42,https://stackoverflow.com/questions/tagged/PostgreSQL?tab=active&page=1&pagesize=15,https://www.gravatar.com/avatar/f9e8f4b7553d9afb6c8676ebde5b13a5?s=32&d=identicon&r=PG&f=y&so-version=2
Optimize cost calculation on time series data in PostgreSQL with TimescaleDB,2 hours ago,dh762,0,0,10,https://stackoverflow.com/questions/tagged/PostgreSQL?tab=active&page=1&pagesize=15,https://i.stack.imgur.com/OqbHX.png?s=32&g=1
Postgres: Trigger on FOREIGN TABLE,2 hours ago,Mark B,10,2,5k,https://stackoverflow.com/questions/tagged/PostgreSQL?tab=active&page=1&pagesize=15,https://lh3.googleusercontent.com/a/AItbvmlU1OQQz_N-ZK4ZXSZsC0nOt5yJs5rgoxbdb6pP=k-s32
Azure Postgresql Felxible server: pg_dump aborting because of server version mismatch,2 hours ago,Bilal,0,0,6,https://stackoverflow.com/questions/tagged/PostgreSQL?tab=active&page=1&pagesize=15,https://www.gravatar.com/avatar/688dbfc69c1a47647f163e62e2460ecc?s=32&d=identicon&r=PG
What is the correct way of obtaining LWLocks in postgres?,3 hours ago,SriKeerthi Revuru,0,0,7,https://stackoverflow.com/questions/tagged/PostgreSQL?tab=active&page=1&pagesize=15,https://lh3.googleusercontent.com/a/ALm5wu3Mv0atr2V-aGvveVmTrmkmDJUU3haQOUZzDvlOgQ=k-s32
"syntax error at or near ""-"" in PostgreSQL",3 hours ago,Sameer,43,5,291k,https://stackoverflow.com/questions/tagged/PostgreSQL?tab=active&page=1&pagesize=15,https://i.stack.imgur.com/nkV3L.jpg?s=32&g=1
