title,time,writer,votes,answers,views,url
"Solution of sparse linear system on GPU, paper from nvidia",1 min ago,张路晨,0,2,204,https://stackoverflow.com/questions/tagged/CUDA?tab=active&page=1&pagesize=15
The code of Parallel Solution of Sparse Triangular Linear Systems in the Preconditioned Iterative Methods on the GPU,4 mins ago,张路晨,0,0,2,https://stackoverflow.com/questions/tagged/CUDA?tab=active&page=1&pagesize=15
Can not find thrust/universal_vector.h in the Thrust library which is included in the CUDA Toolkit,3 hours ago,paleonix,0,1,54,https://stackoverflow.com/questions/tagged/CUDA?tab=active&page=1&pagesize=15
nvcc - add flags to a specific file using cmake,5 hours ago,Amit,0,2,69,https://stackoverflow.com/questions/tagged/CUDA?tab=active&page=1&pagesize=15
Handle arbitrary sized inputs for scan kernel,8 hours ago,Jimenemex,0,0,29,https://stackoverflow.com/questions/tagged/CUDA?tab=active&page=1&pagesize=15
CUDA_HOME error even though CUDA_HOME is set,9 hours ago,Polarimetric,-1,1,23,https://stackoverflow.com/questions/tagged/CUDA?tab=active&page=1&pagesize=15
Facing problems setting cuda,11 hours ago,talonmies,-1,0,30,https://stackoverflow.com/questions/tagged/CUDA?tab=active&page=1&pagesize=15
Is CUDA 12.x inherently incompatible with Qt 6.x?,18 hours ago,Ðаո,-2,0,32,https://stackoverflow.com/questions/tagged/CUDA?tab=active&page=1&pagesize=15
How can I specify flags for CMAKE_<LANG>_HOST_COMPILER?,22 hours ago,einpoklum,3,1,56,https://stackoverflow.com/questions/tagged/CUDA?tab=active&page=1&pagesize=15
Spack installation of NVSHMEM failing due to cannot find -lcuda,23 hours ago,paleonix,0,0,18,https://stackoverflow.com/questions/tagged/CUDA?tab=active&page=1&pagesize=15
CMake: pass list of compiler flags through NVCC,yesterday,Amit,6,3,3k,https://stackoverflow.com/questions/tagged/CUDA?tab=active&page=1&pagesize=15
GPU ID nomenclature in PyTorch and TensorFlow,yesterday,paleonix,0,1,12,https://stackoverflow.com/questions/tagged/CUDA?tab=active&page=1&pagesize=15
"""cudaMemcpyAsync"" invokes cudaError_t : ""invalid argument"" (C++) [closed]",yesterday,Viole,-5,0,46,https://stackoverflow.com/questions/tagged/CUDA?tab=active&page=1&pagesize=15
Analyzing CUDA Matrix Multiplication Efficiency with Nsight Compute: Investigating L2 to Global Write Back Discrepancies,yesterday,paleonix,-3,0,31,https://stackoverflow.com/questions/tagged/CUDA?tab=active&page=1&pagesize=15
cuda::std::complex in Eigen::Matrix causing error,yesterday,Michael Blazej,-2,1,83,https://stackoverflow.com/questions/tagged/CUDA?tab=active&page=1&pagesize=15
