title,time,writer,votes,answers,views,url
Problem Could not find any valid local directory for s3ablock-0001-,14 mins ago,aykcandem,6,4,9k,https://stackoverflow.com/questions/64342539/problem-could-not-find-any-valid-local-directory-for-s3ablock-0001
Merge two columns which conatins array of values and create one column in scala?,35 mins ago,s.polam,-1,1,36,https://stackoverflow.com/questions/78334843/merge-two-columns-which-conatins-array-of-values-and-create-one-column-in-scala
Livy Service is getting stopped frequently in between,43 mins ago,Mr.Robot,-1,0,5,https://stackoverflow.com/questions/78351631/livy-service-is-getting-stopped-frequently-in-between
how the spark read one large splittable file? (logical block and physical block),1 hour ago,matdulgi,0,0,12,https://stackoverflow.com/questions/78351461/how-the-spark-read-one-large-splittable-file-logical-block-and-physical-block
Spark: What is the difference between repartition and repartitionByRange?,1 hour ago,Michael Heil,18,2,19k,https://stackoverflow.com/questions/65809909/spark-what-is-the-difference-between-repartition-and-repartitionbyrange
PySpark withColumn() function doesn't recognize hierarchical structure,4 hours ago,Derek O,1,1,35,https://stackoverflow.com/questions/78339861/pyspark-withcolumn-function-doesnt-recognize-hierarchical-structure
How to retrive the column in a text using pyspark,4 hours ago,Aditya Vikram Singh,0,1,27,https://stackoverflow.com/questions/78333549/how-to-retrive-the-column-in-a-text-using-pyspark
How to do not null check for columns in scala dataframe in an effective way?,5 hours ago,Gastón Schabas,0,1,27,https://stackoverflow.com/questions/78345246/how-to-do-not-null-check-for-columns-in-scala-dataframe-in-an-effective-way
"""file or directory is not a reparse point"" in a network drive -- pyspark run locally on windows",5 hours ago,Ken White,0,0,21,https://stackoverflow.com/questions/78307461/file-or-directory-is-not-a-reparse-point-in-a-network-drive-pyspark-run-loc
Spark custom encoder for dataframe,6 hours ago,Jason Aller,1,0,2k,https://stackoverflow.com/questions/42786885/spark-custom-encoder-for-dataframe
"Spark recommends listing Spark and Hadoop dependencies as provided in the docs, is this strictly required?",7 hours ago,stantonk,0,0,7,https://stackoverflow.com/questions/78350711/spark-recommends-listing-spark-and-hadoop-dependencies-as-provided-in-the-docs
How to update value inside a nested array in spark,8 hours ago,user2314737,3,1,42,https://stackoverflow.com/questions/78347740/how-to-update-value-inside-a-nested-array-in-spark
"Not able to create CSV using Spark dataframe and scala, Instead it is creating folder with `.csv` in folder name",10 hours ago,Olaf Kock,0,0,17,https://stackoverflow.com/questions/78349346/not-able-to-create-csv-using-spark-dataframe-and-scala-instead-it-is-creating-f
Spark UDF doesn't get decoded dataset class using org.typelevel.frameless encoder injection,11 hours ago,Chris,0,1,12,https://stackoverflow.com/questions/78349325/spark-udf-doesnt-get-decoded-dataset-class-using-org-typelevel-frameless-encode
Sequential source switching using structured streming,12 hours ago,Elie Azoury,1,0,17,https://stackoverflow.com/questions/78349549/sequential-source-switching-using-structured-streming
