title,time,writer,votes,answers,views,url,img
MUI - Open datepicker when clicking anywhere in the TextField,7 mins ago,nahoang,10,4,28k,https://stackoverflow.com/questions/67053310/mui-open-datepicker-when-clicking-anywhere-in-the-textfield,https://i.stack.imgur.com/W1b1i.png?s=32&g=1
Unable to import background image from assets folder in React,12 mins ago,OctaviaLo,0,0,7,https://stackoverflow.com/questions/78363960/unable-to-import-background-image-from-assets-folder-in-react,https://i.stack.imgur.com/YXCkX.png?s=32&g=1
"Very new to programming, wondering how to change background colour on nav bar element when it is active? CSS HTML JAVASCRIPT",16 mins ago,Darya Shuhlia,1,2,21,https://stackoverflow.com/questions/78363591/very-new-to-programming-wondering-how-to-change-background-colour-on-nav-bar-el,https://www.gravatar.com/avatar/8931573811f32d36b84d9181b0dbe39a?s=32&d=identicon&r=PG&f=y&so-version=2
Shrink images to fit into nav,37 mins ago,Kat,1,2,27,https://stackoverflow.com/questions/78363587/shrink-images-to-fit-into-nav,https://i.stack.imgur.com/lgoRB.png?s=32&g=1
how to solve the viewport problem in parallax effect?,46 mins ago,Ragavi Jegathesan,0,1,10,https://stackoverflow.com/questions/78363830/how-to-solve-the-viewport-problem-in-parallax-effect,https://i.stack.imgur.com/XM1nD.jpg?s=32&g=1
html and css to insert submenu dropdown items to the main menu,59 mins ago,Joe,1,1,30,https://stackoverflow.com/questions/78361644/html-and-css-to-insert-submenu-dropdown-items-to-the-main-menu,https://www.gravatar.com/avatar/882ae7c186b33928c0558cfa9d4cd5d9?s=32&d=identicon&r=PG&f=y&so-version=2
"How to Select All src Attributes Starting with ""data:"" Using CSS?",1 hour ago,MD Hasan Patwary,-3,1,33,https://stackoverflow.com/questions/78361465/how-to-select-all-src-attributes-starting-with-data-using-css,https://i.stack.imgur.com/1fOSq.jpg?s=32&g=1
How do I identify why my HTML/CSS website is not scrolling?,1 hour ago,billdiver,0,0,18,https://stackoverflow.com/questions/78363779/how-do-i-identify-why-my-html-css-website-is-not-scrolling,https://www.gravatar.com/avatar/81333bc16f21c9743e493c52861e6105?s=32&d=identicon&r=PG&f=y&so-version=2
Styling issue about sidebar with top menu and its children,2 hours ago,David Verduzco,0,0,12,https://stackoverflow.com/questions/78363675/styling-issue-about-sidebar-with-top-menu-and-its-children,https://lh4.googleusercontent.com/-SnRQzkzCdCo/AAAAAAAAAAI/AAAAAAAAAAA/ACHi3rfh89j4gHfxS62BSjrswgBApOaxIA/photo.jpg?sz=32
Flex elements do not take all the available space before breaking into a new line,3 hours ago,Christian,0,1,16,https://stackoverflow.com/questions/78363572/flex-elements-do-not-take-all-the-available-space-before-breaking-into-a-new-lin,https://www.gravatar.com/avatar/6eae325a9ed8381a9d86ac27a4e2f052?s=32&d=identicon&r=PG&f=y&so-version=2
Styling elements using CSS classes with lit (style checkbox as toggle),3 hours ago,arif,0,0,52,https://stackoverflow.com/questions/78339275/styling-elements-using-css-classes-with-lit-style-checkbox-as-toggle,https://www.gravatar.com/avatar/70f9a1dd298209ebb0c901b1b44b5d83?s=32&d=identicon&r=PG&f=y&so-version=2
Pushing second column to next row if text in first column is long,3 hours ago,dale landry,0,1,31,https://stackoverflow.com/questions/78359521/pushing-second-column-to-next-row-if-text-in-first-column-is-long,https://i.stack.imgur.com/eWKcL.jpg?s=32&g=1
Remove the right margin of a flex-wrapped item [duplicate],3 hours ago,Phil,1,0,20,https://stackoverflow.com/questions/78363523/remove-the-right-margin-of-a-flex-wrapped-item,https://www.gravatar.com/avatar/9ad213d8adabe4b64c2d53c5e0e3cab4?s=32&d=identicon&r=PG
I can't decrease the size of my waves in my web site,4 hours ago,IT goldman,0,1,13,https://stackoverflow.com/questions/78363375/i-cant-decrease-the-size-of-my-waves-in-my-web-site,https://i.stack.imgur.com/RhfH5.jpg?s=32&g=1
creating card slider sliding individual card by clicking specific button previous or next using javascript,4 hours ago,Akshay,1,2,59,https://stackoverflow.com/questions/78361171/creating-card-slider-sliding-individual-card-by-clicking-specific-button-previou,https://www.gravatar.com/avatar/37a77d7f8ba4b6e1a1d9278348ee6e77?s=32&d=identicon&r=PG&f=y&so-version=2
