title,time,writer,votes,answers,views,url
Connecting aws documentdb locally,1 hour ago,Carlos Siestrup,0,1,15,https://stackoverflow.com/questions/tagged/MongoDB?tab=active&page=1&pagesize=15
Spring Boot Starter Data MongoDB 2.7.0 xml configuration with empty credential,1 hour ago,Borgy Manotoy,-1,0,17,https://stackoverflow.com/questions/tagged/MongoDB?tab=active&page=1&pagesize=15
MongoDB binary subtype,2 hours ago,qbakom,1,1,26,https://stackoverflow.com/questions/tagged/MongoDB?tab=active&page=1&pagesize=15
Extends mongoose schema with methods - typescript compatible way,3 hours ago,newtocoding,0,2,97,https://stackoverflow.com/questions/tagged/MongoDB?tab=active&page=1&pagesize=15
pymongo pinging and ping from terminal,3 hours ago,KansaiRobot,0,0,11,https://stackoverflow.com/questions/tagged/MongoDB?tab=active&page=1&pagesize=15
add new mongo replica from other server with public ip [closed],3 hours ago,Meysam Goodarzi,1,0,15,https://stackoverflow.com/questions/tagged/MongoDB?tab=active&page=1&pagesize=15
How to configure a replica set with MongoDB,4 hours ago,Reza Taba,12,3,24k,https://stackoverflow.com/questions/tagged/MongoDB?tab=active&page=1&pagesize=15
Mongoose document type declaration,4 hours ago,Yuniac,2,4,3k,https://stackoverflow.com/questions/tagged/MongoDB?tab=active&page=1&pagesize=15
"id is being replaced by _id, of the inner object, when updating data of MongoDB using Java Driver",5 hours ago,Karthik Kudva,0,1,424,https://stackoverflow.com/questions/tagged/MongoDB?tab=active&page=1&pagesize=15
Status: 500 Internal Server Error NodeJS When Make Post Request,5 hours ago,Youssef Hussein,-1,0,12,https://stackoverflow.com/questions/tagged/MongoDB?tab=active&page=1&pagesize=15
how to sort products by users distance using mongo Geospatial Queries?,6 hours ago,We do the best for You,0,1,36,https://stackoverflow.com/questions/tagged/MongoDB?tab=active&page=1&pagesize=15
Method call changes signature between projects,6 hours ago,Lars Melander,0,0,38,https://stackoverflow.com/questions/tagged/MongoDB?tab=active&page=1&pagesize=15
MongoDB with replica set: authentication failed for MONGO_INITDB_ROOT_USERNAME & PASSWORD,6 hours ago,Pungrammer,0,0,17,https://stackoverflow.com/questions/tagged/MongoDB?tab=active&page=1&pagesize=15
Prisma - adding a new property to mongoDB,6 hours ago,user23960184,0,0,10,https://stackoverflow.com/questions/tagged/MongoDB?tab=active&page=1&pagesize=15
how to create daily log files from a single mongod.log file?,7 hours ago,Wernfried Domscheit,0,1,13,https://stackoverflow.com/questions/tagged/MongoDB?tab=active&page=1&pagesize=15
