title,time,writer,votes,answers,views,url,img
openCV gray scale video missing right half,3 hours ago,David Levy,0,0,24,https://stackoverflow.com/questions/78356182/opencv-gray-scale-video-missing-right-half,https://www.gravatar.com/avatar/723a3388694475db06baf745955b8481?s=32&d=identicon&r=PG
OpenCvSharp VideoCapture super slow upon Initialization,4 hours ago,Jorge A.,0,0,10,https://stackoverflow.com/questions/78363490/opencvsharp-videocapture-super-slow-upon-initialization,https://www.gravatar.com/avatar/5946e5ae0f082062051427c81522f03e?s=32&d=identicon&r=PG&f=y&so-version=2
How to display angle found from 3 3d points using opencv-python,4 hours ago,Ana Clara,0,0,183,https://stackoverflow.com/questions/76846787/how-to-display-angle-found-from-3-3d-points-using-opencv-python,https://www.gravatar.com/avatar/f7012becf0d5db1d9bedba25dff5d2c2?s=32&d=identicon&r=PG&f=y&so-version=2
Is there a way to track cars (and their co-ordinates) in a top-down view whilst it is racing through a circuit?,5 hours ago,fmw42,0,0,12,https://stackoverflow.com/questions/78362960/is-there-a-way-to-track-cars-and-their-co-ordinates-in-a-top-down-view-whilst,https://i.stack.imgur.com/6CMNt.jpg?s=32&g=1
"add periodic noise and remove it by using notch , band reject filter",8 hours ago,Osama Mohamed,-5,0,21,https://stackoverflow.com/questions/78363007/add-periodic-noise-and-remove-it-by-using-notch-band-reject-filter,https://graph.facebook.com/4524654027657907/picture?type=large
"I am learning on how to make AI trainer from a tutorial , but when i try to run my code in pycharm i get this error",8 hours ago,aman dhomne,0,0,14,https://stackoverflow.com/questions/78362963/i-am-learning-on-how-to-make-ai-trainer-from-a-tutorial-but-when-i-try-to-run,https://www.gravatar.com/avatar/c97fab6c9db07dab487deccf338ffea8?s=32&d=identicon&r=PG
opencv-python: how to reduce the frame wait timer?,10 hours ago,Дмитрий,0,0,16,https://stackoverflow.com/questions/78362580/opencv-python-how-to-reduce-the-frame-wait-timer,https://www.gravatar.com/avatar/05c67ffe6fe7e0feefe53d69d2873a8e?s=32&d=identicon&r=PG&f=y&so-version=2
Problem with using Gstreamer with Python 3 OpenCV to display and save a video in Desktop with Flir Hadron camera,12 hours ago,SeB,0,1,67,https://stackoverflow.com/questions/78355003/problem-with-using-gstreamer-with-python-3-opencv-to-display-and-save-a-video-in,https://www.gravatar.com/avatar/72f1e50a6b795cc471419f132e6827b4?s=32&d=identicon&r=PG&f=y&so-version=2
I am not able to display and save a video from my Flir hadron camera using Gstreamer command in python3 Opencv,12 hours ago,SeB,0,1,12,https://stackoverflow.com/questions/78361491/i-am-not-able-to-display-and-save-a-video-from-my-flir-hadron-camera-using-gstre,https://www.gravatar.com/avatar/72f1e50a6b795cc471419f132e6827b4?s=32&d=identicon&r=PG&f=y&so-version=2
Label multiple contours with OpenCV,12 hours ago,dalek_fred,-1,0,19,https://stackoverflow.com/questions/78362179/label-multiple-contours-with-opencv,https://www.gravatar.com/avatar/2c3616f3ccc0b3e770ba4102f938401e?s=32&d=identicon&r=PG&f=y&so-version=2
Can not display videos after crop OpenCV-Python,14 hours ago,beaker,0,0,15,https://stackoverflow.com/questions/78361890/can-not-display-videos-after-crop-opencv-python,https://i.stack.imgur.com/eFG0R.png?s=32&g=1
What is the type of blurring in such an image? [closed],15 hours ago,empirefloo,-3,0,32,https://stackoverflow.com/questions/78361658/what-is-the-type-of-blurring-in-such-an-image,https://lh3.googleusercontent.com/a/ALm5wu2Kf8v_PRdiVNZT-kgxrZAn-jZOKdWqnMOAJq0exw=k-s32
Problem with translation while calibrating cameras for stereo vision,16 hours ago,Tobais P,0,0,11,https://stackoverflow.com/questions/78361458/problem-with-translation-while-calibrating-cameras-for-stereo-vision,https://www.gravatar.com/avatar/fd6f3a687fdf4de8e11f7043ec2dfcba?s=32&d=identicon&r=PG
opencv with CUDA support on visual c++ 2022 cv::cudev::blockReduce error [closed],17 hours ago,toyota Supra,-5,0,31,https://stackoverflow.com/questions/78359827/opencv-with-cuda-support-on-visual-c-2022-cvcudevblockreduce-error,https://www.gravatar.com/avatar/db7988a64f79dc8977b341b36a70a374?s=32&d=identicon&r=PG&f=y&so-version=2
OpenCV VideoCapture gives me a gray screen when I'm reading from 3 or more rtsp streams a time,18 hours ago,Matteo Ricci,0,1,140,https://stackoverflow.com/questions/76736531/opencv-videocapture-gives-me-a-gray-screen-when-im-reading-from-3-or-more-rtsp,https://www.gravatar.com/avatar/62ddd7b35218017b0f9e454d038b734e?s=32&d=identicon&r=PG
