title,time,writer,votes,answers,views,url
retryWrites in mongodb python,11 hours ago,Rafa Viotti,3,1,2k,https://stackoverflow.com/questions/61103315/retrywrites-in-mongodb-python
How should I model likes/dislikes in NoSQL?,15 hours ago,sooyeon,0,0,10,https://stackoverflow.com/questions/78348415/how-should-i-model-likes-dislikes-in-nosql
"etcd transaction Commit() returned ""Succeeded: false"", but value was stored?",15 hours ago,armaka,0,0,6,https://stackoverflow.com/questions/78348805/etcd-transaction-commit-returned-succeeded-false-but-value-was-stored
Update UTCDateTimeAttribute attribute in PynamoDB based on conditon,18 hours ago,Siddarth Patil,0,1,10,https://stackoverflow.com/questions/78343741/update-utcdatetimeattribute-attribute-in-pynamodb-based-on-conditon
"How to return the ObjectId or _id of an document in MongoDB? and error ""$in needs an array""",yesterday,Mattia Ferigutti,27,9,104k,https://stackoverflow.com/questions/24557580/how-to-return-the-objectid-or-id-of-an-document-in-mongodb-and-error-in-need
Mongo DB Bson and Java: adding and returning field in child documents that is only present in the parent?,yesterday,cmgchess,2,1,20,https://stackoverflow.com/questions/78340467/mongo-db-bson-and-java-adding-and-returning-field-in-child-documents-that-is-on
How to accomodate an indefinite number of levels for categories and subcategories in Laravel with MySQL database [closed],2 days ago,Fakrudeen P K,-2,0,20,https://stackoverflow.com/questions/78338655/how-to-accomodate-an-indefinite-number-of-levels-for-categories-and-subcategorie
JSON query builder for Cassandra [closed],2 days ago,Hammad Ul Haque,0,0,30,https://stackoverflow.com/questions/78337590/json-query-builder-for-cassandra
Cassandra Database not starting up in windows 10,2 days ago,James Z,0,1,22,https://stackoverflow.com/questions/78332251/cassandra-database-not-starting-up-in-windows-10
How to only get the last item of an array in MongoDB Document using Java/Kotlin,Apr 15 at 21:20,Ellet,-1,1,32,https://stackoverflow.com/questions/78274566/how-to-only-get-the-last-item-of-an-array-in-mongodb-document-using-java-kotlin
Should non-primary-key attributes be part of a DynamoDB table definition?,Apr 15 at 8:44,Yves M.,3,1,1k,https://stackoverflow.com/questions/70739456/should-non-primary-key-attributes-be-part-of-a-dynamodb-table-definition
Using Mongodb with Firebase/Firestore [closed],Apr 14 at 22:41,David Molina,4,1,2k,https://stackoverflow.com/questions/48820736/using-mongodb-with-firebase-firestore
What are some good approaches for initializing a Scylladb database with docker compose?,Apr 14 at 12:35,hanishi,1,3,817,https://stackoverflow.com/questions/75868513/what-are-some-good-approaches-for-initializing-a-scylladb-database-with-docker-c
"MongoDB aggregation, take an array of values and get their amount",Apr 13 at 18:03,ray,0,1,57,https://stackoverflow.com/questions/65348956/mongodb-aggregation-take-an-array-of-values-and-get-their-amount
How to enforce foreign keys in NoSql databases (MongoDB)?,Apr 13 at 16:38,Youssef Atta'i,24,7,25k,https://stackoverflow.com/questions/8195190/how-to-enforce-foreign-keys-in-nosql-databases-mongodb
