title,time,writer,votes,answers,views,url,img
How to check if a string contains emojis in Java,1 min ago,user24492691,0,0,4,https://stackoverflow.com/questions/tagged/Java?tab=active&page=1&pagesize=15,https://www.gravatar.com/avatar/aea247f5e941618b7f58f53333c780b1?s=32&d=identicon&r=PG&f=y&so-version=2
BlockUI loading panel is working in environment but hide in other one,3 mins ago,alisummer2000000,0,0,3,https://stackoverflow.com/questions/tagged/Java?tab=active&page=1&pagesize=15,https://lh5.googleusercontent.com/-T1TNhT_NWCY/AAAAAAAAAAI/AAAAAAAAAAA/ACHi3refbD3baogsOj8j-P9DK0SO4GIKqA/mo/photo.jpg?sz=32
Is it possible to extract a jar from a Native Image built with GraalVM?,4 mins ago,ThCollignon,0,1,24,https://stackoverflow.com/questions/tagged/Java?tab=active&page=1&pagesize=15,https://i.stack.imgur.com/Y1Y74.png?s=32&g=1
Problems to Install Postgresql connector,4 mins ago,Jonas Costa,-1,0,6,https://stackoverflow.com/questions/tagged/Java?tab=active&page=1&pagesize=15,https://lh3.googleusercontent.com/a-/AFdZucoLtZp7621SoaXO_rgj0AJ43TNTxNw7nXvQLPaCtwM=k-s32
Jackson (de-) serialization hashmap with different object types,4 mins ago,lance-java,0,1,17,https://stackoverflow.com/questions/tagged/Java?tab=active&page=1&pagesize=15,https://www.gravatar.com/avatar/1f256b904ff621d678598d8fa49f86c5?s=32&d=identicon&r=PG
Package original jar with fallback native executable,5 mins ago,Daniyaal Khan,0,0,2,https://stackoverflow.com/questions/tagged/Java?tab=active&page=1&pagesize=15,https://www.gravatar.com/avatar/53062f08c5ef64a3d82215169d000879?s=32&d=identicon&r=PG&f=y&so-version=2
"How to Exclude Specific Files (like .properties),some local files from GitHub Copilot in IntelliJ IDEA?",9 mins ago,manda A,0,0,7,https://stackoverflow.com/questions/tagged/Java?tab=active&page=1&pagesize=15,https://www.gravatar.com/avatar/76b4eadff44bebe723fc950e39e9d205?s=32&d=identicon&r=PG&f=y&so-version=2
"""Incorrect inner plaintext: no content type"" in SSL communication",12 mins ago,winmor,0,0,21,https://stackoverflow.com/questions/tagged/Java?tab=active&page=1&pagesize=15,https://www.gravatar.com/avatar/ab6f3a3b75551d97f374722d88634d06?s=32&d=identicon&r=PG&f=y&so-version=2
Fast Way to Convert BufferedImage Pixels with a Specific Color into an Area,13 mins ago,matt,0,1,17,https://stackoverflow.com/questions/tagged/Java?tab=active&page=1&pagesize=15,https://www.gravatar.com/avatar/54af3ad01b032767b05a7e98fede6d6e?s=32&d=identicon&r=PG
Spring Cloud Contract in Groovy unable to identify list of objects,13 mins ago,Puneet Nebhani,0,0,6,https://stackoverflow.com/questions/tagged/Java?tab=active&page=1&pagesize=15,https://i.stack.imgur.com/p8CIi.jpg?s=32&g=1
Adding a time-out to console app in Java for user that takes too long,15 mins ago,Anonymous,-1,1,66,https://stackoverflow.com/questions/tagged/Java?tab=active&page=1&pagesize=15,https://www.gravatar.com/avatar/8283c64511fa80afed5259d10850168f?s=32&d=identicon&r=PG&f=y&so-version=2
How to check option for selected with Thymeleaf and Java Enum,15 mins ago,ps-jakob,0,1,13,https://stackoverflow.com/questions/tagged/Java?tab=active&page=1&pagesize=15,https://www.gravatar.com/avatar/b18eda752b2468e73bddfb0c186a4325?s=32&d=identicon&r=PG&f=y&so-version=2
How can I create new/custom tags in DICOM using dcm4che?,26 mins ago,Amit Joshi,1,1,3k,https://stackoverflow.com/questions/tagged/Java?tab=active&page=1&pagesize=15,https://i.stack.imgur.com/UBIhA.jpg?s=32&g=1
Sequential source switching using structured streaming,30 mins ago,Elie Azoury,1,0,24,https://stackoverflow.com/questions/tagged/Java?tab=active&page=1&pagesize=15,https://lh3.googleusercontent.com/-XdUIqdMkCWA/AAAAAAAAAAI/AAAAAAAAAAA/4252rscbv5M/photo.jpg?sz=32
How to move a specific value to the end of the array without affecting the order of other elements?,38 mins ago,cyberbrain,0,3,108,https://stackoverflow.com/questions/tagged/Java?tab=active&page=1&pagesize=15,https://i.stack.imgur.com/2sp68.png?s=32&g=1
