title,time,writer,votes,answers,views,url
animate not works in mini ipad and mobile,40 mins ago,Carsten Løvbo Andersen,0,0,14,https://stackoverflow.com/questions/78351805/animate-not-works-in-mini-ipad-and-mobile
My Jquery table is only summerizing the first row in the table,1 hour ago,Stefan Fernström,0,0,15,https://stackoverflow.com/questions/78351621/my-jquery-table-is-only-summerizing-the-first-row-in-the-table
Why does my php div not get overwritten when I run a jQuery script? [closed],1 hour ago,KleiaTMT,-4,0,23,https://stackoverflow.com/questions/78351565/why-does-my-php-div-not-get-overwritten-when-i-run-a-jquery-script
how to covert input text in perticular date format like 'dd-MM-yyyy',10 hours ago,gabs712,-1,1,22,https://stackoverflow.com/questions/78349929/how-to-covert-input-text-in-perticular-date-format-like-dd-mm-yyyy
Converting japanese fullwidth characters typed by user to halfwidth character in the same input field,11 hours ago,anik ahmed,1,0,29,https://stackoverflow.com/questions/78349645/converting-japanese-fullwidth-characters-typed-by-user-to-halfwidth-character-in
"TinyMCE, show character count instead of word count",13 hours ago,Scott B,20,6,18k,https://stackoverflow.com/questions/34481959/tinymce-show-character-count-instead-of-word-count
ASP.NET Core MVC validations not being displayed on view for child entities,15 hours ago,marc_s,0,1,15,https://stackoverflow.com/questions/78347566/asp-net-core-mvc-validations-not-being-displayed-on-view-for-child-entities
How to put JSON data in html / javascript grid table [duplicate],16 hours ago,TylerH,5,5,19k,https://stackoverflow.com/questions/13012390/how-to-put-json-data-in-html-javascript-grid-table
Updating existing URL querystring values with jQuery,17 hours ago,Dacili,38,13,90k,https://stackoverflow.com/questions/9622207/updating-existing-url-querystring-values-with-jquery
Add border to parent row cell,17 hours ago,mplungjan,0,3,50,https://stackoverflow.com/questions/78347610/add-border-to-parent-row-cell
Converting data in Javascript to Word/PDF [closed],17 hours ago,PARTH PETKAR,-4,0,26,https://stackoverflow.com/questions/78348129/converting-data-in-javascript-to-word-pdf
"When auto-submitting a form, how do I add a header?",17 hours ago,Community,3,2,24k,https://stackoverflow.com/questions/31706550/when-auto-submitting-a-form-how-do-i-add-a-header
JQuery AJAX call to SOAP Web Service - Access denied. Working in SOAP UI,17 hours ago,Community,0,1,14k,https://stackoverflow.com/questions/18168226/jquery-ajax-call-to-soap-web-service-access-denied-working-in-soap-ui
Swap image on tab selected jQuery [duplicate],17 hours ago,isherwood,1,2,40,https://stackoverflow.com/questions/78346953/swap-image-on-tab-selected-jquery
Can I get a value from a textbox which is in asp:DataGrid which is inside another asp:DataGrid's TemplateColumn in Javascript?,17 hours ago,Jackwin,0,0,6,https://stackoverflow.com/questions/78347938/can-i-get-a-value-from-a-textbox-which-is-in-aspdatagrid-which-is-inside-anothe
