title,time,writer,votes,answers,views,url
Nginx rewrite after a proxy pass when conflict endpoints,26 mins ago,Léo Guillaume,0,0,3,https://stackoverflow.com/questions/tagged/FastAPI?tab=active&page=1&pagesize=15
Why does an asynchronous FastAPI have synchronous code in authorization? [duplicate],44 mins ago,Chris,0,1,17,https://stackoverflow.com/questions/tagged/FastAPI?tab=active&page=1&pagesize=15
FastAPI Stops working afterawhile and then reboots after multiple failed requests,3 hours ago,Munashe Komichi,0,0,20,https://stackoverflow.com/questions/tagged/FastAPI?tab=active&page=1&pagesize=15
Pydantic created at and updated at fields,4 hours ago,hinge,6,3,7k,https://stackoverflow.com/questions/tagged/FastAPI?tab=active&page=1&pagesize=15
FastAPI: 422 Unprocessable Entity [duplicate],5 hours ago,Chris,1,4,38k,https://stackoverflow.com/questions/tagged/FastAPI?tab=active&page=1&pagesize=15
Getting 422 Unprocessable Entity while sending a GET request with list of data to FastAPI backend [duplicate],5 hours ago,Chris,1,0,15,https://stackoverflow.com/questions/tagged/FastAPI?tab=active&page=1&pagesize=15
uvicorn [fastapi] python run both HTTP and HTTPS,6 hours ago,Chris,17,3,40k,https://stackoverflow.com/questions/tagged/FastAPI?tab=active&page=1&pagesize=15
How to return data in JSON format using FastAPI?,6 hours ago,Chris,13,3,26k,https://stackoverflow.com/questions/tagged/FastAPI?tab=active&page=1&pagesize=15
Why am I getting FastAPI value_error.missing?,8 hours ago,Chris,-1,2,48,https://stackoverflow.com/questions/tagged/FastAPI?tab=active&page=1&pagesize=15
How to use await request.form() while allowing validation using Form in FastAPI? [duplicate],8 hours ago,Chris,1,0,32,https://stackoverflow.com/questions/tagged/FastAPI?tab=active&page=1&pagesize=15
FastAPI Application python error JSON not serializable,9 hours ago,Mubashir Ahmed Siddiqui,0,2,49,https://stackoverflow.com/questions/tagged/FastAPI?tab=active&page=1&pagesize=15
Best Practices for Integrating FastAPI with Separate Library in Python Repository Structure [closed],18 hours ago,Santiago Cuervo,-1,0,13,https://stackoverflow.com/questions/tagged/FastAPI?tab=active&page=1&pagesize=15
How to implement concurrent/parallel listen on a WebSocket and a local process?,23 hours ago,Farel Musyaffa,0,0,16,https://stackoverflow.com/questions/tagged/FastAPI?tab=active&page=1&pagesize=15
How to solve this error 'Depends' object has no attribute 'query',23 hours ago,Sharifu,0,0,21,https://stackoverflow.com/questions/tagged/FastAPI?tab=active&page=1&pagesize=15
"Nginx subdomain configuration, Failed to load API definition",23 hours ago,cosmosfactory,0,2,20,https://stackoverflow.com/questions/tagged/FastAPI?tab=active&page=1&pagesize=15
