title,time,writer,votes,answers,views,url
exception sending context initialized event to listener instance of class,1 min ago,Community,0,1,27k,https://stackoverflow.com/questions/19513947/exception-sending-context-initialized-event-to-listener-instance-of-class
How to get last and current quarter first dates for given date in java,5 mins ago,vikram katabathini,0,0,5,https://stackoverflow.com/questions/78351897/how-to-get-last-and-current-quarter-first-dates-for-given-date-in-java
Jmeter SSE script throwing SSL errors related to trustStores,6 mins ago,Sameer Rajimwale,0,2,58,https://stackoverflow.com/questions/78328839/jmeter-sse-script-throwing-ssl-errors-related-to-truststores
Asking about mediocore number case,7 mins ago,Tony H,0,0,8,https://stackoverflow.com/questions/78351885/asking-about-mediocore-number-case
@Context not injected on Resteasy Unit test,21 mins ago,Carles Iglesias,-1,1,17,https://stackoverflow.com/questions/78339334/context-not-injected-on-resteasy-unit-test
A graddle build problem while writing java code,22 mins ago,Easterwood,-1,1,29,https://stackoverflow.com/questions/78347603/a-graddle-build-problem-while-writing-java-code
JAXB not available on Tomcat 9 and Java 9/10,22 mins ago,Mc Bton,32,7,18k,https://stackoverflow.com/questions/51518781/jaxb-not-available-on-tomcat-9-and-java-9-10
How to handle web.xml with multiple exact matches?,24 mins ago,Please,-1,0,29,https://stackoverflow.com/questions/78338830/how-to-handle-web-xml-with-multiple-exact-matches
SmsManager in android,29 mins ago,1239-Ayush VaZe,0,0,6,https://stackoverflow.com/questions/78351763/smsmanager-in-android
Decrypt/Modify Password of Realm Tag in Server.xml file of Tomcat - LDAP,33 mins ago,phLamBy,0,1,25,https://stackoverflow.com/questions/78279561/decrypt-modify-password-of-realm-tag-in-server-xml-file-of-tomcat-ldap
is it a good idea to use kafka for update and insert operations in java project?,35 mins ago,CodingBee,0,0,6,https://stackoverflow.com/questions/78351723/is-it-a-good-idea-to-use-kafka-for-update-and-insert-operations-in-java-project
Start an app from layered jar directories?,44 mins ago,chris01,0,0,10,https://stackoverflow.com/questions/78351686/start-an-app-from-layered-jar-directories
Task from Brazil ICPC with translating z-array(z-function) to prefix-array(KMP function) and vise-versa,44 mins ago,Nikifor Telpuk,0,0,12,https://stackoverflow.com/questions/78351677/task-from-brazil-icpc-with-translating-z-arrayz-function-to-prefix-arraykmp-f
Grails Native Sql Query result returning Date field as LocalDateTime,49 mins ago,Deepak Gupta,0,0,6,https://stackoverflow.com/questions/78351661/grails-native-sql-query-result-returning-date-field-as-localdatetime
How to create native header file,59 mins ago,Person,-1,0,14,https://stackoverflow.com/questions/78351627/how-to-create-native-header-file
