title,time,writer,votes,answers,views,url,img
PyTorch CNN doesn't update loss and weight parameter while training,2 mins ago,YJ C,0,0,3,https://stackoverflow.com/questions/78363996/pytorch-cnn-doesnt-update-loss-and-weight-parameter-while-training,https://www.gravatar.com/avatar/da7c1d0be7130f69615c082b8884b8ec?s=32&d=identicon&r=PG&f=y&so-version=2
How to load local image files to a hugging faces dataset?,43 mins ago,Naomi Fridman,0,0,7,https://stackoverflow.com/questions/78363813/how-to-load-local-image-files-to-a-hugging-faces-dataset,https://i.stack.imgur.com/RW3yd.jpg?s=32&g=1
Classification problem with multi categories using Neural Networks,4 hours ago,dpalma,0,0,6,https://stackoverflow.com/questions/78363467/classification-problem-with-multi-categories-using-neural-networks,https://www.gravatar.com/avatar/fef983664f45e796a07f863d810c305e?s=32&d=identicon&r=PG&f=y&so-version=2
Test loss immediately goes up on LSTM,7 hours ago,Muhammed Yunus,0,1,94,https://stackoverflow.com/questions/78300613/test-loss-immediately-goes-up-on-lstm,https://i.stack.imgur.com/ThUyh.png?s=32&g=1
PyTorch Lightning CSVLogger: Why are training and validation losses on different lines?,9 hours ago,Ivan,0,1,20,https://stackoverflow.com/questions/78359357/pytorch-lightning-csvlogger-why-are-training-and-validation-losses-on-different,https://i.stack.imgur.com/eiYzG.png?s=32&g=1
Need help using vgg16 model to train an classification AI (21 classes),9 hours ago,Ivan,-1,0,14,https://stackoverflow.com/questions/78362196/need-help-using-vgg16-model-to-train-an-classification-ai-21-classes,https://i.stack.imgur.com/eiYzG.png?s=32&g=1
Whether there is any need to modify the backward function in pytorch?,9 hours ago,Ivan,0,1,17,https://stackoverflow.com/questions/78361756/whether-there-is-any-need-to-modify-the-backward-function-in-pytorch,https://i.stack.imgur.com/eiYzG.png?s=32&g=1
"My CNN Can Only Take In Multiple Images, How Do I Make It Able To Take In 1 Image?",13 hours ago,WatchingZ,2,0,37,https://stackoverflow.com/questions/78356672/my-cnn-can-only-take-in-multiple-images-how-do-i-make-it-able-to-take-in-1-imag,https://www.gravatar.com/avatar/cff570d4891293598cde6924ff25c713?s=32&d=identicon&r=PG&f=y&so-version=2
pytorch error: Inference tensors cannot be saved for backward. To work around you can make a clone to get a normal tensor and use it in autograd,14 hours ago,Võ Huyền Bảo Hân,0,1,19,https://stackoverflow.com/questions/78353279/pytorch-error-inference-tensors-cannot-be-saved-for-backward-to-work-around-yo,https://www.gravatar.com/avatar/510a229273a92dc6b20d3b8bf71c407a?s=32&d=identicon&r=PG&f=y&so-version=2
ValueError: too many values to unpack (expected 2) not working [closed],14 hours ago,Michael Butscher,-2,0,24,https://stackoverflow.com/questions/78361509/valueerror-too-many-values-to-unpack-expected-2-not-working,https://www.gravatar.com/avatar/ace6dfd8c4f8c95d5a3fddc020af97f8?s=32&d=identicon&r=PG
Can Graph Neural Networks Produce Accurate Embeddings with Only Node Attributes at Inference Time?,15 hours ago,InternetUser0947,0,0,11,https://stackoverflow.com/questions/78361734/can-graph-neural-networks-produce-accurate-embeddings-with-only-node-attributes,https://www.gravatar.com/avatar/e0b2e74a07e45d6caefe07a5c1f3ba6c?s=32&d=identicon&r=PG&f=y&so-version=2
How to match predicted bounding boxes to ground-truth bounding boxes,15 hours ago,Lelouch,0,1,15,https://stackoverflow.com/questions/78361473/how-to-match-predicted-bounding-boxes-to-ground-truth-bounding-boxes,https://lh3.googleusercontent.com/a-/AOh14GjRzExPUoOW3_1i6wKD4LluHHkoWKpLMkV_ZfwV=k-s32
"Whenever I try to install torch, it displays killed",16 hours ago,abduvali murodullayev,28,2,20k,https://stackoverflow.com/questions/62301268/whenever-i-try-to-install-torch-it-displays-killed,https://lh3.googleusercontent.com/a/AAcHTtdyqhvmBWDeaQ7XtYHMj9xKfjt0ENtHify2IcNdtQly7w=k-s32
Error whilst loading Celeba Dataset from torchvision,17 hours ago,Sahl Ebrahim,0,0,7,https://stackoverflow.com/questions/78361350/error-whilst-loading-celeba-dataset-from-torchvision,https://lh3.googleusercontent.com/-KD6Bep4usB8/AAAAAAAAAAI/AAAAAAAACh0/3vZfnrwINdo/photo.jpg?sz=32
tensorflow.python.framework.errors_impl.FailedPreconditionError: runs\train\exp3 is not a directory,17 hours ago,עטרה חדד,0,1,375,https://stackoverflow.com/questions/76934905/tensorflow-python-framework-errors-impl-failedpreconditionerror-runs-train-exp3,https://www.gravatar.com/avatar/2a8ef12c64c045385d3ccdf218070064?s=32&d=identicon&r=PG&f=y&so-version=2
