title,time,writer,votes,answers,views,url
How to use material-ui styled components inside Next.js server components,18 hours ago,Netanel Vaknin,0,0,8,https://stackoverflow.com/questions/tagged/styled-components?tab=active&page=1&pagesize=15
"@parcel/transformer-babel, Styled Components, Styled Theming: ""a problem adding namespaces"" and ""fake-element-placeholder-0""",21 hours ago,Voice in the Desert,0,0,10,https://stackoverflow.com/questions/tagged/styled-components?tab=active&page=1&pagesize=15
Prevent creating stylesheet file. ionic,yesterday,sumith deepan,0,1,19,https://stackoverflow.com/questions/tagged/styled-components?tab=active&page=1&pagesize=15
How to pass 'className' as a props when using styled-components?,yesterday,RexiaN,0,0,20,https://stackoverflow.com/questions/tagged/styled-components?tab=active&page=1&pagesize=15
ThemeProvider from Styled-components not working in storybook (Next.js 13),Apr 15 at 13:50,Odiri Teddie,0,1,13,https://stackoverflow.com/questions/tagged/styled-components?tab=active&page=1&pagesize=15
"Typescript styled-component error: ""Type '{ children: string; }' has no properties in common with type 'IntrinsicAttributes'.""",Apr 15 at 6:30,Sazzadhusen Iproliya,66,9,136k,https://stackoverflow.com/questions/tagged/styled-components?tab=active&page=1&pagesize=15
Change styled-component percentage transform animation according to useState value,Apr 15 at 1:42,Taylor Avon,-1,0,24,https://stackoverflow.com/questions/tagged/styled-components?tab=active&page=1&pagesize=15
"error TS2322: Property 'css' does not exist on type 'DetailedHTMLProps<HTMLAttributes<HTMLDivElement>, HTMLDivElement>'",Apr 14 at 14:47,DavGarcia,6,8,10k,https://stackoverflow.com/questions/tagged/styled-components?tab=active&page=1&pagesize=15
Next.js `transpilePackages` giving Webpack error with Styled Components,Apr 14 at 13:06,hi-im-b,1,1,28,https://stackoverflow.com/questions/tagged/styled-components?tab=active&page=1&pagesize=15
Css properties as falsie values in react,Apr 14 at 11:30,Sanket Mundada,0,1,48,https://stackoverflow.com/questions/tagged/styled-components?tab=active&page=1&pagesize=15
Can't Get styled-components to Pass any props,Apr 14 at 2:29,Odiri Teddie,0,2,32,https://stackoverflow.com/questions/tagged/styled-components?tab=active&page=1&pagesize=15
"""TypeError: Cannot read properties of undefined (reading 'withConfig')"" styled-components/react/rollup/babel",Apr 12 at 19:18,prantosh Verma,0,1,900,https://stackoverflow.com/questions/tagged/styled-components?tab=active&page=1&pagesize=15
Passing props to styled components in React,Apr 12 at 12:23,Pavan Kalyan Payyavula,0,1,59,https://stackoverflow.com/questions/tagged/styled-components?tab=active&page=1&pagesize=15
How can I overwrite the styling that is specified using vanilla-extract globalStyle?,Apr 11 at 18:59,xmnt,0,2,96,https://stackoverflow.com/questions/tagged/styled-components?tab=active&page=1&pagesize=15
Border under selected element,Apr 10 at 8:26,Harrison,0,0,50,https://stackoverflow.com/questions/tagged/styled-components?tab=active&page=1&pagesize=15
