title,time,writer,votes,answers,views,url
How do I position my text beside my slideshow,1 min ago,Cédric,0,0,9,https://stackoverflow.com/questions/tagged/html?tab=active&page=1&pagesize=15
Fixed table header with bootstrap,1 min ago,Lee Taylor,1,2,14k,https://stackoverflow.com/questions/tagged/html?tab=active&page=1&pagesize=15
How can I load an image after clicking a button?,4 mins ago,isherwood,0,3,21k,https://stackoverflow.com/questions/tagged/html?tab=active&page=1&pagesize=15
Custom shape with clip-path,4 mins ago,Lil_PhyziX,-1,1,32,https://stackoverflow.com/questions/tagged/html?tab=active&page=1&pagesize=15
CSS loading but changes not taking effect?,6 mins ago,Stefan,0,1,18,https://stackoverflow.com/questions/tagged/html?tab=active&page=1&pagesize=15
Add a link to an access file in sharepoint online,8 mins ago,Lil_PhyziX,0,2,38,https://stackoverflow.com/questions/tagged/html?tab=active&page=1&pagesize=15
"When the search box is emptied, all the data appears on my pagination",15 mins ago,Rico Buenviaje,0,0,15,https://stackoverflow.com/questions/tagged/html?tab=active&page=1&pagesize=15
Setting an HTML5 form as invalid even when all elements are considered valid?,15 mins ago,davetron5000,0,0,5,https://stackoverflow.com/questions/tagged/html?tab=active&page=1&pagesize=15
"""::after"" of HTML-element not shown [closed]",17 mins ago,isherwood,-1,0,21,https://stackoverflow.com/questions/tagged/html?tab=active&page=1&pagesize=15
HTML form next and Submit buttons are ignoring required fields,19 mins ago,sumith deepan,0,1,31,https://stackoverflow.com/questions/tagged/html?tab=active&page=1&pagesize=15
How can I override a screen-reader's pronunciation of a word in a sentence without having it pause mid-sentence?,27 mins ago,Andy,12,3,5k,https://stackoverflow.com/questions/tagged/html?tab=active&page=1&pagesize=15
100vh div has half page height when printing pdf,29 mins ago,K J,1,1,38,https://stackoverflow.com/questions/tagged/html?tab=active&page=1&pagesize=15
HLS.js playlist could not be loaded and the video doesn't work on my web site,29 mins ago,Andrey,0,0,7,https://stackoverflow.com/questions/tagged/html?tab=active&page=1&pagesize=15
Call using Skype from html without prompt window,30 mins ago,ahuemmer,1,2,116,https://stackoverflow.com/questions/tagged/html?tab=active&page=1&pagesize=15
Difference between border and border-width attributes in CSS styling,32 mins ago,Harrison,-5,2,2k,https://stackoverflow.com/questions/tagged/html?tab=active&page=1&pagesize=15
