title,time,writer,votes,answers,views,url
Cloud Run fails with SSL errors or uncaught signal errors when queueing tasks to cloud task,36 mins ago,Lucas,0,1,280,https://stackoverflow.com/questions/tagged/google-cloud-platform?tab=active&page=1&pagesize=15
Google Places API: IP not authorized to use Places API,48 mins ago,noor.soreti,0,0,3,https://stackoverflow.com/questions/tagged/google-cloud-platform?tab=active&page=1&pagesize=15
How to perform URL rewrite on HTTPS Loadbalancer for a Backend Bucket?,1 hour ago,Mauricio,0,1,24,https://stackoverflow.com/questions/tagged/google-cloud-platform?tab=active&page=1&pagesize=15
What is the preferred way to load data from an API into BigQuery?,1 hour ago,Brian Tompsett - 汤莱恩,3,2,9k,https://stackoverflow.com/questions/tagged/google-cloud-platform?tab=active&page=1&pagesize=15
Determine Google Cloud Logs size in bytes generated from Cloud Run services,1 hour ago,Muhammad Sherief,0,0,5,https://stackoverflow.com/questions/tagged/google-cloud-platform?tab=active&page=1&pagesize=15
Google Security Assessment for Enterprise Only Users (@company.com),1 hour ago,ashutosha.56,0,0,5,https://stackoverflow.com/questions/tagged/google-cloud-platform?tab=active&page=1&pagesize=15
How to execute command in a pod (kubernetes) using API?,2 hours ago,RaulK,13,4,10k,https://stackoverflow.com/questions/tagged/google-cloud-platform?tab=active&page=1&pagesize=15
CORS issue with GCP signed URL,2 hours ago,Jakub Kukul,10,2,9k,https://stackoverflow.com/questions/tagged/google-cloud-platform?tab=active&page=1&pagesize=15
ConnectionTimeoutError: Connection timeout in Redis-6.2.7,2 hours ago,user24466292,1,3,5k,https://stackoverflow.com/questions/tagged/google-cloud-platform?tab=active&page=1&pagesize=15
Unity 2022.03.22f Upgrade and GPGS Import: Resolving Gradle Errors and 'Split Application Binary' Issues,4 hours ago,마동찬,0,0,3,https://stackoverflow.com/questions/tagged/google-cloud-platform?tab=active&page=1&pagesize=15
Custom google analytics API in laravel,5 hours ago,Usama Jalal,0,0,9,https://stackoverflow.com/questions/tagged/google-cloud-platform?tab=active&page=1&pagesize=15
Google Functions break when accessing value of body,5 hours ago,Uros Randelovic,2,3,59,https://stackoverflow.com/questions/tagged/google-cloud-platform?tab=active&page=1&pagesize=15
Why the Torchserver in GoogleCloud not retaining the API request for long time? [closed],5 hours ago,Brian Tompsett - 汤莱恩,-3,0,15,https://stackoverflow.com/questions/tagged/google-cloud-platform?tab=active&page=1&pagesize=15
Firebase cli app distribution is too slow. How can I speed it up?,5 hours ago,xywz,0,0,209,https://stackoverflow.com/questions/tagged/google-cloud-platform?tab=active&page=1&pagesize=15
Error code 403 trying to sign provided bytes: IAM Service Account Credentials API has not been used in project 452351230840 before or it is disabled,6 hours ago,Bablu Kova,0,0,5,https://stackoverflow.com/questions/tagged/google-cloud-platform?tab=active&page=1&pagesize=15
