title,time,writer,votes,answers,views,url,img
Why .gitconfig [includeIf] does not work?,42 mins ago,Philippe Carphin,39,13,20k,https://stackoverflow.com/questions/64843104/why-gitconfig-includeif-does-not-work,https://lh5.googleusercontent.com/-eplDCRnuvNQ/AAAAAAAAAAI/AAAAAAAAAD0/YLYTg3l-0e0/photo.jpg?sz=32
How to duplicate a git repository? (without forking),57 mins ago,Jeremy Caney,160,13,164k,https://stackoverflow.com/questions/6613166/how-to-duplicate-a-git-repository-without-forking,https://www.gravatar.com/avatar/68e9ff807fadeaa41ece5dcf761a03c1?s=32&d=identicon&r=PG
Rename branch on merge request,2 hours ago,Rohit,7,1,3k,https://stackoverflow.com/questions/67264506/rename-branch-on-merge-request,https://www.gravatar.com/avatar/3c25c34f7cc48b562813ded9918ec30e?s=32&d=identicon&r=PG&f=y&so-version=2
Why do my local folder names differ from the remote repo folder names?,2 hours ago,Phil,-1,0,16,https://stackoverflow.com/questions/78363646/why-do-my-local-folder-names-differ-from-the-remote-repo-folder-names,https://www.gravatar.com/avatar/9ad213d8adabe4b64c2d53c5e0e3cab4?s=32&d=identicon&r=PG
How to move many repositories from the internal network Git to the company server GitLab at once?,3 hours ago,Daeyeong Park,0,0,10,https://stackoverflow.com/questions/78363606/how-to-move-many-repositories-from-the-internal-network-git-to-the-company-serve,https://www.gravatar.com/avatar/be1684d9c90e4ae80d183e19c753a0b8?s=32&d=identicon&r=PG&f=y&so-version=2
git commit not working github (GIT: Failed to execute git ),6 hours ago,Adam,-1,0,47,https://stackoverflow.com/questions/78354995/git-commit-not-working-github-git-failed-to-execute-git,https://www.gravatar.com/avatar/dd89d5904fee1427d1db5fa1b23f58cf?s=32&d=identicon&r=PG
"Git: If I've been working in detached head state for multiple commits, will I lose anything by getting out of it?",8 hours ago,VonC,1,2,101,https://stackoverflow.com/questions/71346938/git-if-ive-been-working-in-detached-head-state-for-multiple-commits-will-i-lo,https://i.stack.imgur.com/I4fiW.jpg?s=32&g=1
How to list all text (non-binary) files in a git repository?,8 hours ago,CervEd,29,5,5k,https://stackoverflow.com/questions/18973057/how-to-list-all-text-non-binary-files-in-a-git-repository,https://i.stack.imgur.com/uX1jp.jpg?s=32&g=1
Why does git update-ref accepts non /refs references?,8 hours ago,VonC,15,2,10k,https://stackoverflow.com/questions/36006054/why-does-git-update-ref-accepts-non-refs-references,https://i.stack.imgur.com/I4fiW.jpg?s=32&g=1
GIT_PS1_SHOWUPSTREAM not displaying information,8 hours ago,VonC,3,2,1k,https://stackoverflow.com/questions/10725044/git-ps1-showupstream-not-displaying-information,https://i.stack.imgur.com/I4fiW.jpg?s=32&g=1
Understanding git gc --auto,9 hours ago,VonC,18,3,11k,https://stackoverflow.com/questions/16337498/understanding-git-gc-auto,https://i.stack.imgur.com/I4fiW.jpg?s=32&g=1
How to turn off the help hints in git output?,9 hours ago,VonC,16,5,7k,https://stackoverflow.com/questions/55463863/how-to-turn-off-the-help-hints-in-git-output,https://i.stack.imgur.com/I4fiW.jpg?s=32&g=1
Apply git patch created with git diff,9 hours ago,VonC,8,1,9k,https://stackoverflow.com/questions/61497078/apply-git-patch-created-with-git-diff,https://i.stack.imgur.com/I4fiW.jpg?s=32&g=1
Is it possible to add/commit a file to the index of a local bare Git repo?,9 hours ago,VonC,4,3,1k,https://stackoverflow.com/questions/5538018/is-it-possible-to-add-commit-a-file-to-the-index-of-a-local-bare-git-repo,https://i.stack.imgur.com/I4fiW.jpg?s=32&g=1
How to check for changes on remote (origin) Git repository,10 hours ago,Banana,304,9,361k,https://stackoverflow.com/questions/2514270/how-to-check-for-changes-on-remote-origin-git-repository,https://i.stack.imgur.com/OKmAG.png?s=32&g=1
