title,time,writer,votes,answers,views,url,img
flask variable import error give me module not found error,3 mins ago,furas,0,0,11,https://stackoverflow.com/questions/tagged/Flask?tab=active&page=1&pagesize=15,https://i.stack.imgur.com/relWs.jpg?s=32&g=1
How to measure Flask API response time and record them in logs?,22 mins ago,roganjosh,0,1,17,https://stackoverflow.com/questions/tagged/Flask?tab=active&page=1&pagesize=15,https://i.stack.imgur.com/6VQlo.jpg?s=32&g=1
"""Flask and JavaScript Password Generator: Unable to Display Generated Password on Webpage",1 hour ago,Kenzo Staelens,0,1,17,https://stackoverflow.com/questions/tagged/Flask?tab=active&page=1&pagesize=15,https://lh3.googleusercontent.com/-wQ8TQ0A-FEM/AAAAAAAAAAI/AAAAAAAAAAA/ACHi3re-vlj8B984pmGHkM41Rhzm1auZ0Q/mo/photo.jpg?sz=32
Flask application freezes on initial startup but works fine after multiple attempts,1 hour ago,Mehmet Ali Öden,0,0,10,https://stackoverflow.com/questions/tagged/Flask?tab=active&page=1&pagesize=15,https://www.gravatar.com/avatar/f9fdf9ee25f66700658ef098b275b13a?s=32&d=identicon&r=PG&f=y&so-version=2
How to use use flask-caching decorator @cache on an external module class,2 hours ago,ASDFQWERTY,3,1,676,https://stackoverflow.com/questions/tagged/Flask?tab=active&page=1&pagesize=15,https://www.gravatar.com/avatar/b53b00c2d63cab9365dfc6c2313a3bdb?s=32&d=identicon&r=PG
Can't load image from local Flask server to React app,2 hours ago,Mohammed Sameer,0,1,20,https://stackoverflow.com/questions/tagged/Flask?tab=active&page=1&pagesize=15,https://www.gravatar.com/avatar/405b71fbd67731a7d2b0d0ee75508b2d?s=32&d=identicon&r=PG
Both Text and Image generation,3 hours ago,Rohit,-1,0,9,https://stackoverflow.com/questions/tagged/Flask?tab=active&page=1&pagesize=15,https://www.gravatar.com/avatar/34d4e7e59c60bdef0278bd8699c72eb5?s=32&d=identicon&r=PG&f=y&so-version=2
How can I mock the return value for a method in a class that uses a context manager,3 hours ago,Teemu Risikko,0,1,21,https://stackoverflow.com/questions/tagged/Flask?tab=active&page=1&pagesize=15,https://i.stack.imgur.com/fFDad.jpg?s=32&g=1
Unable to Host Flask App as a Application in IIS - Getting 404 error. The requested URL was not found on the server,6 hours ago,James Z,0,0,14,https://stackoverflow.com/questions/tagged/Flask?tab=active&page=1&pagesize=15,https://i.stack.imgur.com/J6pYX.png?s=32&g=1
My flask application is giving error of scope when using tokens to retrieve the zoom team-chats,8 hours ago,Usama Khalid,0,0,9,https://stackoverflow.com/questions/tagged/Flask?tab=active&page=1&pagesize=15,https://lh3.googleusercontent.com/a/AEdFTp5fd06n30OFUF_Ir1rpX6wutq_XmLLpyiZPV9Jm=k-s32
Integrating flask-session and express-session,9 hours ago,Keiran,0,0,11,https://stackoverflow.com/questions/tagged/Flask?tab=active&page=1&pagesize=15,https://i.stack.imgur.com/ewbJB.png?s=32&g=1
How can I correctly define routes in nginx for a flask app?,11 hours ago,Suta Purachina,-1,0,17,https://stackoverflow.com/questions/tagged/Flask?tab=active&page=1&pagesize=15,https://lh3.googleusercontent.com/a/AATXAJyCm1igRiiuQ3fGITYtYyJYmL--dLvWRApoYU6f=k-s32
Responsive items not working in Flask local web server,12 hours ago,Rubén S. García,0,1,754,https://stackoverflow.com/questions/tagged/Flask?tab=active&page=1&pagesize=15,https://i.stack.imgur.com/e92uv.jpg?s=32&g=1
How can I improve my register and log in page to make it look more visually appealing and make it clearer to read/understand?,12 hours ago,Maria_19,-1,0,11,https://stackoverflow.com/questions/tagged/Flask?tab=active&page=1&pagesize=15,https://www.gravatar.com/avatar/d6128d3293fc6dc50de84aa46780355b?s=32&d=identicon&r=PG&f=y&so-version=2
Flask Session Variable Not Keeping Values,12 hours ago,user24204655,0,0,11,https://stackoverflow.com/questions/tagged/Flask?tab=active&page=1&pagesize=15,https://www.gravatar.com/avatar/7db62371c96da7fddb09bf4942d6421d?s=32&d=identicon&r=PG&f=y&so-version=2
