title,time,writer,votes,answers,views,url,img
Adding values to a dataframe based on lookup in the same dataframe,3 mins ago,Serge de Gosson de Varennes,0,1,12,https://stackoverflow.com/questions/tagged/Pandas?tab=active&page=1&pagesize=15,https://i.stack.imgur.com/BdgYs.jpg?s=32&g=1
Offsetting pandas dataframe with dates,30 mins ago,Kunal Prabhu,0,0,13,https://stackoverflow.com/questions/tagged/Pandas?tab=active&page=1&pagesize=15,https://lh6.googleusercontent.com/-red5ulPCOVQ/AAAAAAAAAAI/AAAAAAAAAAA/AAKWJJM5rVlXt5pASOfelnlhfnKb2JNiyA/photo.jpg?sz=32
Calculating an ongoing win streak in a dataframe,34 mins ago,petezurich,2,2,46,https://stackoverflow.com/questions/tagged/Pandas?tab=active&page=1&pagesize=15,https://i.stack.imgur.com/HaW1a.png?s=32&g=1
How to use create_pandas_dataframe_agent in langchain to pass any custom variable in prompt,35 mins ago,riyagarg0597,0,0,6,https://stackoverflow.com/questions/tagged/Pandas?tab=active&page=1&pagesize=15,https://www.gravatar.com/avatar/4e8fc06965b80164a0aac01d23ab6484?s=32&d=identicon&r=PG&f=y&so-version=2
Filter columns from a list and create new column if not present in list,38 mins ago,Nick,-1,1,18,https://stackoverflow.com/questions/tagged/Pandas?tab=active&page=1&pagesize=15,https://i.stack.imgur.com/pqE2g.jpg?s=32&g=1
Pandas - add rows in a grouped dataframe with varying values,44 mins ago,ziying35,0,1,16,https://stackoverflow.com/questions/tagged/Pandas?tab=active&page=1&pagesize=15,https://lh3.googleusercontent.com/a/AATXAJyZikriJWJ6c8LK_l5H6X5HQ_gsOJfd6VaN3--M=k-s32
How do I convert this code to work with vaex,1 hour ago,Intijir,0,0,19,https://stackoverflow.com/questions/tagged/Pandas?tab=active&page=1&pagesize=15,https://www.gravatar.com/avatar/15292897b6044211132e522eeefcca9b?s=32&d=identicon&r=PG&f=y&so-version=2
Reading UTC timestamp in python pandas and converting it to European dates,1 hour ago,Panagiotis Kanavos,0,2,30,https://stackoverflow.com/questions/tagged/Pandas?tab=active&page=1&pagesize=15,https://i.stack.imgur.com/vwnA5.jpg?s=32&g=1
incompatible dtype in dataframe,1 hour ago,A.Patrick,2,1,31,https://stackoverflow.com/questions/tagged/Pandas?tab=active&page=1&pagesize=15,https://www.gravatar.com/avatar/3cd8d593b9dbb4cd4521215d4d8067bd?s=32&d=identicon&r=PG&f=y&so-version=2
Pandas - calculate time series delta from at least 2 days ago,2 hours ago,Soudipta Dutta,0,3,43,https://stackoverflow.com/questions/tagged/Pandas?tab=active&page=1&pagesize=15,https://lh4.googleusercontent.com/-M-ERj3iEOpc/AAAAAAAAAAI/AAAAAAAAACU/ss1BFMGhrmk/photo.jpg?sz=32
"How to extract the Table Name, Colum name,data Type info and description from SQL Meta data using python? [closed]",2 hours ago,Thangarajtest,-3,0,29,https://stackoverflow.com/questions/tagged/Pandas?tab=active&page=1&pagesize=15,https://www.gravatar.com/avatar/bb0d1dcfb18a8ede4f4374483c30ea34?s=32&d=identicon&r=PG&f=y&so-version=2
Matching string values in a pandas Series from values in list,2 hours ago,Michael Felman,-2,1,49,https://stackoverflow.com/questions/tagged/Pandas?tab=active&page=1&pagesize=15,https://www.gravatar.com/avatar/e4a136d549aafdf1027371ca1ee8ebde?s=32&d=identicon&r=PG&f=y&so-version=2
Why is subtracting pandas.timedelta from pandas.date not vectorized?,2 hours ago,FObersteiner,0,1,31,https://stackoverflow.com/questions/tagged/Pandas?tab=active&page=1&pagesize=15,https://i.stack.imgur.com/be8Y6.jpg?s=32&g=1
Count repeating values in multiple time series,2 hours ago,ziying35,1,2,43,https://stackoverflow.com/questions/tagged/Pandas?tab=active&page=1&pagesize=15,https://lh3.googleusercontent.com/a/AATXAJyZikriJWJ6c8LK_l5H6X5HQ_gsOJfd6VaN3--M=k-s32
Python pandas drop duplicates with if else condition,2 hours ago,ziying35,0,3,67,https://stackoverflow.com/questions/tagged/Pandas?tab=active&page=1&pagesize=15,https://lh3.googleusercontent.com/a/AATXAJyZikriJWJ6c8LK_l5H6X5HQ_gsOJfd6VaN3--M=k-s32
