title,time,writer,votes,answers,views,url
Android Error: Cannot resolve symbol 'PackageList',16 mins ago,VelocityPulse,3,6,14k,https://stackoverflow.com/questions/tagged/react-native?tab=active&page=1&pagesize=15
Folder and File Naming in React Native,32 mins ago,user18309290,0,0,14,https://stackoverflow.com/questions/tagged/react-native?tab=active&page=1&pagesize=15
firestore issue cant save data in firestore database [duplicate],46 mins ago,Frank van Puffelen,0,1,18,https://stackoverflow.com/questions/tagged/react-native?tab=active&page=1&pagesize=15
Nativewind not generate style with child components which was passed props from parent,55 mins ago,Hai Tien,0,0,5,https://stackoverflow.com/questions/tagged/react-native?tab=active&page=1&pagesize=15
BLE scanning not detecting specific device on Samsung device running Android 11 and below,1 hour ago,Md Afzaal Khan,0,0,8,https://stackoverflow.com/questions/tagged/react-native?tab=active&page=1&pagesize=15
ERROR Error sending to server: [AxiosError: Network Error],1 hour ago,Alan Sillva,0,0,7,https://stackoverflow.com/questions/tagged/react-native?tab=active&page=1&pagesize=15
"Fastlane, Github actions. Scheme is not currently configured for the build action",1 hour ago,Venkat Ramana,0,1,19,https://stackoverflow.com/questions/tagged/react-native?tab=active&page=1&pagesize=15
"""Cannot find EventEmitter for receivedTouches"" when using a RecyclerView inside a React native UI Component",1 hour ago,Thomas Berthaud,0,1,8,https://stackoverflow.com/questions/tagged/react-native?tab=active&page=1&pagesize=15
MathJax rendering maths issues,1 hour ago,Mike 'Pomax' Kamermans,-3,0,12,https://stackoverflow.com/questions/tagged/react-native?tab=active&page=1&pagesize=15
Markers collision detection on react-native-maps,1 hour ago,Krešimir Galić,0,0,11,https://stackoverflow.com/questions/tagged/react-native?tab=active&page=1&pagesize=15
Headless Js Task Services in react-native,2 hours ago,girikumar,-1,0,4,https://stackoverflow.com/questions/tagged/react-native?tab=active&page=1&pagesize=15
Local Notification with Notifee does not displaying in Android,2 hours ago,Habibur Rahman,3,4,4k,https://stackoverflow.com/questions/tagged/react-native?tab=active&page=1&pagesize=15
React Native Tabnavigation Animation,2 hours ago,Community,7,1,15k,https://stackoverflow.com/questions/tagged/react-native?tab=active&page=1&pagesize=15
React Native Card Carousel view custom,2 hours ago,arif kk,-1,0,12,https://stackoverflow.com/questions/tagged/react-native?tab=active&page=1&pagesize=15
How can i solve this problem that shows up when i try to build my android app,2 hours ago,CoderBoy,-5,0,23,https://stackoverflow.com/questions/tagged/react-native?tab=active&page=1&pagesize=15
