title,time,writer,votes,answers,views,url
When run the be --version give me error of the ModuleNotFoundError: No module named 'imp',15 mins ago,phd,0,1,11,https://stackoverflow.com/questions/tagged/Django?tab=active&page=1&pagesize=15
A Big Issue in django LoginView,25 mins ago,Abbas Babaee,2,2,53,https://stackoverflow.com/questions/tagged/Django?tab=active&page=1&pagesize=15
ForeignKey to multiple Models or Queryset,30 mins ago,johnthagen,25,4,30k,https://stackoverflow.com/questions/tagged/Django?tab=active&page=1&pagesize=15
Django signup: set username to provided email address and save?,47 mins ago,Olasubomi,0,2,931,https://stackoverflow.com/questions/tagged/Django?tab=active&page=1&pagesize=15
Should model fields be tested in Django?,49 mins ago,Chukwujiobi Canon,0,1,43,https://stackoverflow.com/questions/tagged/Django?tab=active&page=1&pagesize=15
Soft deletion in many-to-many relationships with through model in Django,52 mins ago,robamemar,0,2,35,https://stackoverflow.com/questions/tagged/Django?tab=active&page=1&pagesize=15
Custom the `on_delete` param function in Django model fields,1 hour ago,johnthagen,3,4,6k,https://stackoverflow.com/questions/tagged/Django?tab=active&page=1&pagesize=15
AttributeError: module 'django.conf.global_settings' has no attribute 'ROOT_URLCONF' no solutions found worked,1 hour ago,Ralf,-1,3,450,https://stackoverflow.com/questions/tagged/Django?tab=active&page=1&pagesize=15
How to display the uuid field of my serializer as a string in a get request with django restframework,1 hour ago,Edward Ji,1,2,36,https://stackoverflow.com/questions/tagged/Django?tab=active&page=1&pagesize=15
"Django: Hide button in template, if user is not super-user",1 hour ago,sodimel,55,3,57k,https://stackoverflow.com/questions/tagged/Django?tab=active&page=1&pagesize=15
Upload files from Nextjs to Django backend using api route,1 hour ago,Invulner,0,0,9,https://stackoverflow.com/questions/tagged/Django?tab=active&page=1&pagesize=15
Allauth SocialConnectView django rest framework,1 hour ago,Ralf,0,0,15,https://stackoverflow.com/questions/tagged/Django?tab=active&page=1&pagesize=15
Django static files showing ONLY if debugger is started (with DEBUG=True),1 hour ago,Blaisemart,0,1,19,https://stackoverflow.com/questions/tagged/Django?tab=active&page=1&pagesize=15
"Django Form Error ""This field is required."" only when trying to retrieve random objects",1 hour ago,Ake,0,0,10,https://stackoverflow.com/questions/tagged/Django?tab=active&page=1&pagesize=15
Django: Add values from dict Queryset,1 hour ago,Blaisemart,0,1,32,https://stackoverflow.com/questions/tagged/Django?tab=active&page=1&pagesize=15
